index,model,sentence_id,sentence_en,correct_sentence,correct_word,mutation_type,trigger_type,incorrect_word,incorrect_sentence,p_correct,p_incorrect
224,britllm/britllm-3b-v0.1,cy_ccg_train:00655,To what extent are television programs to blame?,I ba raddau y mae rhaglenni teledu ar fai?,fai,SM,L,mai,I ba raddau y mae rhaglenni teledu ar mai?,2.4242568016052246,2.826775074005127
225,britllm/britllm-3b-v0.1,cy_ccg_train:00054,"Three women from Patagonia will be coming to Wales this summer to study Welsh, thanks to scholarships worth £ 2000 each from the National Center for Learning Welsh.","Bydd tair o ferched o Batagonia yn dod i Gymru dros yr haf er mwyn astudio'r Gymraeg, diolch i ysgoloriaethau gwerth £2000 yr un gan y Ganolfan Dysgu Cymraeg Genedlaethol.",Gymru,SM,L,Cymru,"Bydd tair o ferched o Batagonia yn dod i Cymru dros yr haf er mwyn astudio'r Gymraeg, diolch i ysgoloriaethau gwerth £2000 yr un gan y Ganolfan Dysgu Cymraeg Genedlaethol.",1.164509892463684,1.2633312940597534
226,britllm/britllm-3b-v0.1,cy_ccg_test:00183,"""The experience was unbelievably good"" he told me.","""Roedd y profiad yn anhygoel o dda"" meddai wrthof fi.",dda,SM,L,da,"""Roedd y profiad yn anhygoel o da"" medai wrthof fi.",1.8859506845474243,2.628779649734497
227,britllm/britllm-3b-v0.1,cy_ccg_test:00310,"Powys lost much of its territory, which used to extend east of the existing border, including the old center, Pengwern.","Collodd Powys cryn dipyn o'i thiriogaeth, oedd yn arfer ymestyn i'r dwyrain o'r ffin bresennol, gan gynnwys yr hen ganolfan, Pengwern.",bresennol,SM,MS,presennol,"Collodd Powys cryn dipyn o'i thiriogaeth, oedd yn arfer ymestyn i'r dwyrain o'r ffin presennol, gan gynnwys yr hen ganolfan, Pengwern.",1.5269263982772827,1.551039218902588
228,britllm/britllm-3b-v0.1,cy_ccg_train:00650,I walked from Llanfyllin; how many miles did i walk?,Mi gerddais o Lanfyllin; sawl milltir gerddais i?,Lanfyllin,SM,L,Llanfyllin,Mi gerddais o Llanfyllin; sawl milltir gerddais i?,2.7777342796325684,2.857557535171509
229,britllm/britllm-3b-v0.1,cy_ccg_train:00292,"By the late 1920s, therefore, the Urdd had grown from a magazine organization to an active and dynamic movement.","Erbyn diwedd y 1920au felly, yr oedd yr Urdd wedi tyfu o fod yn fudiad cylchgrawn i fod yn fudiad gweithredol a deinamig.",fod,SM,L,bod,"Erbyn diwedd y 1920au felly, yr oedd yr Urdd wedi tyfu o fod yn fudiad cylchgrawn i bod yn fudiad gweithredol a deinamig.",1.23353111743927,1.3265727758407593
230,britllm/britllm-3b-v0.1,cy_ccg_dev:00350,"We also call on the Welsh Government to keep to their word that they would develop a single real learning Welsh continuum, and to give Qualifications Wales clear direction to develop one qualification that will give all pupils an equal opportunity to leave school able to communicate and speak Welsh confidently and fluently.","Rydym hefyd yn galw ar Lywodraeth Cymru i gadw at eu gair y byddent yn datblygu un continwwm dysgu Cymraeg go iawn, ac i roi cyfarwyddyd clir i Cymwysterau Cymru i ddatblygu un cymhwyster fydd yn rhoi cyfle cyfartal i bob disgybl adael yr ysgol yn medru cyfathrebu a siarad Cymraeg yn hyderus a rhugl.",Cymru,no_mutation,no_mutation,Gymru,"Rydym hefyd yn galw ar Lywodraeth Cymru i gadw at eu gair y byddent yn datblygu un continwwm dysgu Cymraeg go iawn, ac i roi cyfarwyddyd clir i Cymwysterau Gymru i ddatblygu un cymhwyster fydd yn rhoi cyfle cyfartal i bob disgybl adael yr ysgol yn medru cyfathrebu a siarad Cymraeg yn hyderus a rhugl.",1.2611740827560425,1.390079140663147
231,britllm/britllm-3b-v0.1,cy_ccg_dev:00294,"Over in Bangladesh, over 4 million people work in fashion factories making clothes that are sold worldwide.","Draw ym Mangladesh, mae dros 4 miliwn o bobl yn gweithio mewn ffatrïoedd ffasiwn yn gwneud dillad sy'n cael eu gwerthu ledled y byd.",cael,no_mutation,no_mutation,gael,"Draw ym Mangladesh, mae dros 4 miliwn o bobl yn gweithio mewn ffatrïoedd ffasiwn yn gwneud dillad sy'n gael eu gwerthu ledled y byd.",1.1491527557373047,1.2913358211517334
232,britllm/britllm-3b-v0.1,cy_ccg_test:00152,"This is a word frequency analysis of 1079032 words of written Welsh prose, based on 500 samples of about 2000 words each.","Mae hwn yn ddadansoddiad amlder geiriau o 1079032 o eiriau o ryddiaith Gymraeg ysgrifenedig, a seiliwyd ar 500 o samplau o tua 2000 o eiriau yr un.",Gymraeg,SM,MS,Cymraeg,"Mae hwn yn ddadansoddiad amlder geiriau o 1079032 o eiriau o ryddiaith Cymraeg ysgrifenedig, a seiliwyd ar 500 o samplau o tua 2000 o eiriau yr un.",1.729016900062561,1.7378449440002441
233,britllm/britllm-3b-v0.1,cy_ccg_train:01137,,"Os na wnaethoch chi gystadlu, tybed fuodd yna grafu pen a dadlau yn eich tŷ chi, wrth fynd ati i geisio adnabod y lluniau?",tŷ,no_mutation,no_mutation,dŷ,"Os na wnaethoch chi gystadlu, tybed fuodd yna grafu pen a dadlau yn eich dŷ chi, wrth fynd ati i geisio adnabod y lluniau?",2.2450509071350098,2.3782730102539062
234,britllm/britllm-3b-v0.1,cy_ccg_train:00784,I am extremely proud that Dafydd Gibbard has been appointed as the new Chief Executive of Gwynedd Council.,Rydw i'n hynod falch fod Dafydd Gibbard wedi ei benodi yn Brif Weithredwr newydd Cyngor Gwynedd.,Weithredwr,SM,MS,Gweithredwr,Rydw i'n hynod falch fod Dafydd Gibbard wedi ei benodi yn Brif Gweithredwr newydd Cyngor Gwynedd.,1.167035460472107,1.3679152727127075
235,britllm/britllm-3b-v0.1,cy_ccg_train:00442,"It is extremely important, therefore, that this does not disrupt the broadcast.","Mae'n hynod bwysig, felly, nad yw hyn yn amharu ar y darllediad.",bwysig,SM,L,pwysig,"Mae'n hynod pwysig, felly, nad yw hyn yn amharu ar y darllediad.",1.297485113143921,1.5570087432861328
236,britllm/britllm-3b-v0.1,cy_ccg_dev:00279,"Although it will not be possible to call in the office or telephone during this time, you will be able to contact us by email and all our electronic systems will remain operational.","Er na fydd hi'n bosib galw yn y swyddfa na ffonio yn ystod y cyfnod yma, byddwch yn gallu cysylltu â ni drwy e-bost a bydd ein holl systemau electronig yn parhau yn weithredol.",bosib,SM,MS,posib,"Er na fydd hi'n posib galw yn y swyddfa na ffonio yn ystod y cyfnod yma, byddwch yn gallu cysylltu â ni drwy e-bost a bydd ein holl systemau electronig yn parhau yn weithredol.",1.1594558954238892,1.2546555995941162
237,britllm/britllm-3b-v0.1,cy_ccg_test:00822,"A friend of mine here had bought two tickets to see Frank Turner, and asked me to go with him.","Roedd ffrind i mi yma wedi prynu dau docyn i fynd i weld Frank Turner, ac wedi gofyn i mi fynd gyda hi.",fynd,SM,MS,mynd,"Roedd ffrind i mi yma wedi prynu dau docyn i fynd i weld Frank Turner, ac wedi gofyn i mi mynd gyda hi.",1.5640077590942383,1.6954874992370605
238,britllm/britllm-3b-v0.1,cy_ccg_dev:00295,"I don't have to explain to you that working conditions are tough and the pay is depressing, despite the high demand for change.","Dydw i ddim yn gorfod egluro i chi fod yr amodau gweithio yn galad a'r tal yn dorcalonnus, er y galw mawr am newid.",tal,no_mutation,no_mutation,dal,"Dydw i ddim yn gorfod egluro i chi fod yr amodau gweithio yn galad a'r dal yn dorcalonnus, er y galw mawr am newid.",2.271733522415161,2.2359230518341064
239,britllm/britllm-3b-v0.1,cy_ccg_train:00604,"Under the restrictions of covid, it was a miracle that a limited number had the privilege of seeing the play ""Faust and Greta"", a co-production between Cwmni'r Fran Wen, Theatr Genedlaethol Cymru and the Pontio centre.","Dan gyfyngiadau covid, roedd hi'n wyrth bod nifer cyfyngedig wedi cael y fraint o weld y ddrama ""Faust a Greta"", cydgynhyrchiad rhwng Cwmni'r Fran Wen, Theatr Genedlaethol Cymru a chanolfan Pontio.",wyrth,SM,MS,gwyrth,"Dan gyfyngiadau covid, roedd hi'n gwyrth bod nifer cyfyngedig wedi cael y fraint o weld y ddrama ""Faust a Greta"", cydgynhyrchiad rhwng Cwmni'r Fran Wen, Theatr Genedlaethol Cymru a chanolfan Pontio.",1.7499791383743286,1.7937403917312622
240,britllm/britllm-3b-v0.1,cy_ccg_train:00727,Can I ask you something?,Ga' i ofyn rywbeth wrthot ti?,rywbeth,SM,MS,rhywbeth,Ga' i ofyn rhywbeth wrthot ti?,2.353940486907959,2.186728000640869
241,britllm/britllm-3b-v0.1,cy_ccg_train:00217,"After a second wind, the town center calls.","Ar ôl cael ail wynt, mae canol y dref yn galw.",wynt,SM,L,gwynt,"Ar ôl cael ail gwynt, mae canol y dref yn galw.",2.241964340209961,2.423694372177124
242,britllm/britllm-3b-v0.1,cy_ccg_test:00493,"A third bridge would improve journey times, allow better flow of traffic and improve the A55's ability to cope, as well as increase opportunities for active travel.","Byddai trydydd pont yn gwella amseroedd teithio, yn caniatáu i'r traffig lifo'n well ac yn sicrhau bod yr A55 yn gallu ymdopi'n well, yn ogystal â sicrhau bod mwy o gyfleoedd i deithio yn llesol.",gyfleoedd,SM,L,cyfleoedd,"Byddai trydydd pont yn gwella amseroedd teithio, yn caniatáu i'r traffig lifo'n well ac yn sicrhau bod yr A55 yn gallu ymdopi'n well, yn ogystal â sicrhau bod mwy o cyfleoedd i deithio yn llesol.",1.1708346605300903,1.2603507041931152
243,britllm/britllm-3b-v0.1,cy_ccg_train:00017,The Welsh Government has committed to replace Welsh second language with one continuum of Welsh learning and one Welsh qualification per pupil since 2015.,Mae Llywodraeth Cymru wedi ymrwymo i ddisodli Cymraeg ail iaith gydag un continwwm o ddysgu Cymraeg ac un cymhwyster Cymraeg i bob disgybl ers 2015.,Cymraeg,no_mutation,no_mutation,Gymraeg,Mae Llywodraeth Cymru wedi ymrwymo i ddisodli Cymraeg ail iaith gydag un continwwm o ddysgu Gymraeg ac un cymhwyster Gymraeg i bob disgybl ers 2015.,1.3354604244232178,1.4264414310455322
244,britllm/britllm-3b-v0.1,cy_ccg_test:00441,No wonder many people from north Wales feel so hostile towards this organization.,Nid oes rhyfedd fod llawer o bobl o'r gogledd yn teimlo mor elyniaethus tuag at y sefydliad hwn.,fod,SM,MS,bod,Nid oes rhyfedd bod llawer o bobl o'r gogledd yn teimlo mor elyniaethus tuag at y sefydliad hwn.,1.2647534608840942,1.2466884851455688
245,britllm/britllm-3b-v0.1,cy_ccg_dev:00296,"With millions of families relying on work in these factories, coronavirus has turned a frightening and dangerous situation into something truly catastrophic.","Gyda miliyna'o deuluoedd yn dibynnu ar waith yn y ffatrïoedd yma, mae coronafeirws wedi troi sefyllfa oedd yn ofidus ac yn beryglus yn barod i fod yn un gwir trychinebus.",deuluoedd,SM,L,teuluoedd,"Gyda miliyna'o teuluoedd yn dibynnu ar waith yn y ffatrïoedd yma, mae coronafeirws wedi troi sefyllfa oedd yn ofidus ac yn beryglus yn barod i fod yn un gwir trychinebus.",1.9965488910675049,1.9638913869857788
246,britllm/britllm-3b-v0.1,cy_ccg_dev:00224,"And the point is that the community spirit in Blaenau and the surrounding villages in the ""Vale"" is so strong, and so much the focus of life in the area, that you won't be surprised that the regeneration of the area has led mainly by the residents themselves.","A'r pwynt yw bod ysbryd y gymuned ym Mlaenau a'r pentrefi cyfagos  yn y ""Fro"" mor gryf, ac yn gymaint o ganolbwynt bywyd yn yr ardal, fel na fydd yn eich synnu fod adfywio'r ardal wedi'i arwain yn bennaf gan y preswylwyr eu hunain.",bennaf,SM,MS,pennaf,"A'r pwynt yw bod ysbryd y gymuned ym Mlaenau a'r pentrefi cyfagos  yn y ""Fro"" mor gryf, ac yn gymaint o ganolbwynt bywyd yn yr ardal, fel na fydd yn eich synnu fod adfywio'r ardal wedi'i arwain yn pennaf gan y preswylwyr eu hunain.",1.5375016927719116,1.6262978315353394
247,britllm/britllm-3b-v0.1,cy_ccg_train:00881,Will Elwyn discover the answer before it's too late?,A fydd Elwyn yn darganfod yr ateb cyn iddi fynd yn rhy hwyr?,fynd,SM,MS,mynd,A fydd Elwyn yn darganfod yr ateb cyn iddi mynd yn rhy hwyr?,1.2458971738815308,1.4826081991195679
248,britllm/britllm-3b-v0.1,cy_ccg_train:00318,"External auditors have been appointed to investigate allegations that the Welsh Government bribed the Welsh Language Commissioner to conduct fewer complaints investigations, according to newly disclosed correspondence.","Mae archwilwyr allanol wedi cael ei benodi i ymchwilio i honiadau bod Llywodraeth Cymru wedi llwgrwobrwyo Comisiynydd y Gymraeg i gynnal llai o ymchwiliadau i gwynion, yn ôl gohebiaeth sydd newydd gael ei datgelu.",gael,SM,L,cael,"Mae archwilwyr allanol wedi cael ei benodi i ymchwilio i honiadau bod Llywodraeth Cymru wedi llwgrwobrwyo Comisiynydd y Gymraeg i gynnal llai o ymchwiliadau i gwynion, yn ôl gohebiaeth sydd newydd cael ei datgelu.",1.1253559589385986,1.1779603958129883
249,britllm/britllm-3b-v0.1,cy_ccg_train:01159,,"Bydd y penwythnos hefyd yn cynnwys nifer o ddigwyddiadau ymylol a fydd yn cael eu cyhoeddi maes o law, a Marchnad Indy, lle cewch gyfle i brynu a rhyngweithio â nifer o gwmnïau a sefydliadau pro-indy.",gwmnïau,SM,L,cwmnïau,"Bydd y penwythnos hefyd yn cynnwys nifer o ddigwyddiadau ymylol a fydd yn cael eu cyhoeddi maes o law, a Marchnad Indy, lle cewch gyfle i brynu a rhyngweithio â nifer o cwmnïau a sefydliadau pro-indy.",1.3068195581436157,1.3687289953231812
250,britllm/britllm-3b-v0.1,cy_ccg_train:00359,"It is particularly interesting to assess the different types of theatrical theories that have existed for centuries, and how it developed after a number of historical events.","Y mae'n hynod o ddiddorol i gael asesu'r wahanol fathau o ddamcaniaethau theatraidd a fodolir ers canrifoedd, a sut yr oedd yn datblygu wedi i nifer o ddigwyddiadau hanesyddol.",gael,SM,L,cael,"Y mae'n hynod o ddiddorol i cael asesu'r wahanol fathau o ddamcaniaethau theatraidd a fodolir ers canrifoedd, a sut yr oedd yn datblygu wedi i nifer o ddigwyddiadau hanesyddol.",1.6971169710159302,1.7387845516204834
251,britllm/britllm-3b-v0.1,cy_ccg_train:00725,"My other daughter, Lisa, came back from London to raise her children too and she lives six houses away from me, an old mum's house.","Mi ddaeth fy merch arall, Lisa, nôl o Lundain i fagu ei phlant hi hefyd ac mae hi'n byw chwech tŷ oddi wrthaf fi, yn hen dŷ mam.",dŷ,SM,MS,tŷ,"Mi ddaeth fy merch arall, Lisa, nôl o Lundain i fagu ei phlant hi hefyd ac mae hi'n byw chwech tŷ oddi wrthaf fi, yn hen tŷ mam.",2.195589542388916,2.2289671897888184
252,britllm/britllm-3b-v0.1,cy_ccg_test:00901,"At Cambridge he studied philosophy, mathematics and Greek, graduating as a bachelor of arts in 1568 and master in 1571.","Yng Nghaergrawnt fe astudiodd athroniaeth, mathemateg a Groeg gan raddio'n faglor yn y celfyddydau ym 1568 ac yn feistr ym 1571.",faglor,SM,MS,baglor,"Yng Nghaergrawnt fe astudiodd athroniaeth, mathemateg a Groeg gan raddio'n baglor yn y celfyddydau ym 1568 ac yn feistr ym 1571.",1.391838550567627,1.497200846672058
253,britllm/britllm-3b-v0.1,cy_ccg_train:01055,"Storytellers and singers will perform around the fire on the edge of the main festival, and there will be a live radio broadcast during the weekend, as well as an opportunity and specific area for speakers of the language to gather and practice their Irish.","Bydd storïwyr a chantorion yn perfformio o amgylch y tân ar gyrion y brif ŵyl, a bydd darllediad radio byw yn ystod y penwythnos, yn ogystal â chyfle ac ardal benodol i siaradwyr yr iaith ymgasglu ac ymarfer eu Gwyddeleg.",bydd,no_mutation,no_mutation,fydd,"Bydd storïwyr a chantorion yn perfformio o amgylch y tân ar gyrion y brif ŵyl, a fydd darllediad radio byw yn ystod y penwythnos, yn ogystal â chyfle ac ardal benodol i siaradwyr yr iaith ymgasglu ac ymarfer eu Gwyddeleg.",1.571965217590332,1.6329526901245117
254,britllm/britllm-3b-v0.1,cy_ccg_test:00726,Once it becomes clear that you want to be absent for more than 13 weeks your Housing and Council Tax Benefit will stop.,Unwaith iddi ddod yn amlwg eich bod am fod yn absennol am fwy na 13 wythnos bydd eich Budd-dal Tai a Threth Cyngor yn peidio.,fod,SM,L,bod,Unwaith iddi ddod yn amlwg eich bod am bod yn absennol am fwy na 13 wythnos bydd eich Budd-dal Tai a Threth Cyngor yn peidio.,1.5578844547271729,1.6737630367279053
255,britllm/britllm-3b-v0.1,cy_ccg_train:00945,"They will also be strong in terms of influence, once combined into a party.","Byddant yn gryf o ran dylanwad hefyd, ar ôl eu cyfuno'n blaid.",dylanwad,no_mutation,no_mutation,ddylanwad,"Byddant yn gryf o ran ddylanwad hefyd, ar ôl eu cyfuno'n blaid.",2.3457655906677246,2.5381548404693604
256,britllm/britllm-3b-v0.1,cy_ccg_train:01039,"The Diogelwn scheme was launched in 2021 so that owners could protect the Welsh names on their houses, but it has now been expanded to include names on land, and the scheme in its new form will be presented at an event on the Cymdeithas stand the Language on the field of the Eisteddfod today.","Lansiwyd cynllun Diogelwn yn 2021 er mwyn i berchnogion allu diogelu'r enwau Cymraeg ar eu tai, ond mae e bellach wedi ei ehangu i gynnwys enwau ar dir, a bydd y cynllun ar ei newydd wedd yn cael ei gyflwyno mewn digwyddiad ar stondin Cymdeithas yr Iaith ar faes yr Eisteddfod heddiw.",cael,no_mutation,no_mutation,gael,"Lansiwyd cynllun Diogelwn yn 2021 er mwyn i berchnogion allu diogelu'r enwau Cymraeg ar eu tai, ond mae e bellach wedi ei ehangu i gynnwys enwau ar dir, a bydd y cynllun ar ei newydd wedd yn gael ei gyflwyno mewn digwyddiad ar stondin Cymdeithas yr Iaith ar faes yr Eisteddfod heddiw.",1.3625868558883667,1.4260754585266113
257,britllm/britllm-3b-v0.1,cy_ccg_dev:00108,"But they are not necessarily very easy to find, and unlike more visible lakes such as Llyn Padarn and Llyn Tegid they are not easy to spot as you drive by on a day out.","Ond nid ydynt o angenrheidrwydd yn hawdd iawn i'w darganfod, ac yn wahanol i lynnoedd mwy gweladwy megis Llyn Padarn a Llyn Tegid nid ydynt yn hawdd i'w gweld wrth i chi yrru heibio ar ddiwrnod allan.",gweld,no_mutation,no_mutation,weld,"Ond nid ydynt o angenrheidrwydd yn hawdd iawn i'w darganfod, ac yn wahanol i lynnoedd mwy gweladwy megis Llyn Padarn a Llyn Tegid nid ydynt yn hawdd i'w weld wrth i chi yrru heibio ar ddiwrnod allan.",1.2637494802474976,1.3017246723175049
258,britllm/britllm-3b-v0.1,cy_ccg_train:00581,Remember that young people aged 16 and 17 have the right to vote in the Senedd elections in May.,Cofiwch fod gan bobol ifanc 16 ac 17 oed yr hawl i bleidleisio yn etholiadau'r Senedd ym mis Mai.,bobol,SM,L,pobol,Cofiwch fod gan pobol ifanc 16 ac 17 oed yr hawl i bleidleisio yn etholiadau'r Senedd ym mis Mai.,0.8427533507347107,0.9127853512763977
259,britllm/britllm-3b-v0.1,cy_ccg_dev:00297,Many people have been sent home from work without paying with the factories losing contracts.,Mae nifer fawr o bobl wedi cael eu gyrru adra o'u gwaith heb dal gyda'r ffatrïoedd yn colli cytundebau.,dal,SM,L,tal,Mae nifer fawr o bobl wedi cael eu gyrru adra o'u gwaith heb tal gyda'r ffatrïoedd yn colli cytundebau.,1.866848111152649,1.8944933414459229
260,britllm/britllm-3b-v0.1,cy_ccg_train:01134,,"Mae'n siwr bod pob anrheg wedi ei dderbyn yn ddiolchgar, ond go brin bod yr un ohonynt mor werthfawr ag anrheg Louis i'w chwaer Zoe.",bod,no_mutation,no_mutation,fod,"Mae'n siwr fod pob anrheg wedi ei dderbyn yn ddiolchgar, ond go brin bod yr un ohonynt mor werthfawr ag anrheg Louis i'w chwaer Zoe.",1.79373300075531,1.7840832471847534
261,britllm/britllm-3b-v0.1,cy_ccg_train:00032,According to the EU brazidiers that prevented us from making a good deal on marketing as some of the countries in the Union look after their own interests and stand against any deal on marketing that will benefit Britain.,Yn ôl y brecsidiers yr UE oedd yn ein hatal o wneud fargen da ar farchnata gan fod rhai o'r gwledydd yn yr Undeb yn edrych ar ôl eu budd eu hunain ac yn sefyll yn erbyn unrhyw fargen ar farchnata bydd o fantais i Brydain.,Brydain,SM,L,Prydain,Yn ôl y brecsidiers yr UE oedd yn ein hatal o wneud fargen da ar farchnata gan fod rhai o'r gwledydd yn yr Undeb yn edrych ar ôl eu budd eu hunain ac yn sefyll yn erbyn unrhyw fargen ar farchnata bydd o fantais i Prydain.,2.0536961555480957,2.0737130641937256
262,britllm/britllm-3b-v0.1,cy_ccg_train:01169,,"Rydyn ni wedi bod ar flaen y gad o ran diwylliant Cymru ers dros ddeugain mlynedd, ac rydyn ni'n falch o fod yn lleoliad llawr gwlad a hyrwyddwr cerddoriaeth mwyaf blaenllaw Cymru.",Cymru,no_mutation,no_mutation,Gymru,"Rydyn ni wedi bod ar flaen y gad o ran diwylliant Cymru ers dros ddeugain mlynedd, ac rydyn ni'n falch o fod yn lleoliad llawr gwlad a hyrwyddwr cerddoriaeth mwyaf blaenllaw Gymru.",1.170978307723999,1.2287027835845947
263,britllm/britllm-3b-v0.1,cy_ccg_dev:00316,"The website will continue to contain advice and signpost you to current information to help you, your families and businesses prepare for these changes.","Bydd y wefan yn parhau i gynnwys cyngor ac yn eich cyfeirio at wybodaeth gyfredol er mwyn eich helpu chi, eich teuluoedd a'ch busnesau i baratoi ar gyfer y newidiadau hyn.",gyfer,SM,L,cyfer,"Bydd y wefan yn parhau i gynnwys cyngor ac yn eich cyfeirio at wybodaeth gyfredol er mwyn eich helpu chi, eich teuluoedd a'ch busnesau i baratoi ar cyfer y newidiadau hyn.",1.0921515226364136,1.3058760166168213
264,britllm/britllm-3b-v0.1,cy_ccg_train:00619,"John Harold, director of Cymdeithas Eryri, which helps to maintain the mountains, said that the location has become a ""honey pot"" for walkers.","Dywedodd John Harold, cyfarwyddwr Cymdeithas Eryri, sy'n helpu i gynnal a chadw'r mynyddoedd, fod y lleoliad wedi dod yn ""bot mêl"" i gerddwyr.",lleoliad,no_mutation,no_mutation,leoliad,"Dywedodd John Harold, cyfarwyddwr Cymdeithas Eryri, sy'n helpu i gynnal a chadw'r mynyddoedd, fod y leoliad wedi dod yn ""bot mêl"" i gerddwyr.",1.450087547302246,1.5755964517593384
265,britllm/britllm-3b-v0.1,cy_ccg_dev:00104,"It became a market town for the whole of Llŷn, as evidenced by the site known as ""The Maes"" where the fairs were held, and ""Pig Street"".","Tyfodd i fod yn dref marchnad i Lŷn gyfan, fel y tystia'r safle a adwaenir fel ""Y Maes"" lle y cynhelid y ffeiriau, a ""Stryd Moch"".",Lŷn,SM,L,Llŷn,"Tyfodd i fod yn dref marchnad i Llŷn gyfan, fel y tystia'r safle a adwaenir fel ""Y Maes"" lle y cynhelid y ffeiriau, a ""Stryd Moch"".",1.9654308557510376,2.0460777282714844
266,britllm/britllm-3b-v0.1,cy_ccg_train:00081,"On the other hand there have been every facility for witnesses from Slovenia, Austria and the United States to speak in their own languages with a consecutive translation.","Ar y llaw arall bu pob cyfleuster i dystion o Slofenia, Awstria a'r Unol Daleithiau siarad yn eu hieithoedd hwythau â chyfieithiad olynol.",pob,no_mutation,no_mutation,bob,"Ar y llaw arall bu bob cyfleuster i dystion o Slofenia, Awstria a'r Unol Daleithiau siarad yn eu hieithoedd hwythau â chyfieithiad olynol.",1.9306211471557617,1.935258150100708
267,britllm/britllm-3b-v0.1,cy_ccg_train:01330,,"""Mae'n ymdriniaeth dawel a sensitif â'r hyn sydd yn rhaid ei wneud i helpu'r fam barhau i fyw'n urddasol wrth i'w chof hi ddadfeilio,"" meddai.",barhau,SM,MS,parhau,"""Mae'n ymdriniaeth dawel a sensitif â'r hyn sydd yn rhaid ei wneud i helpu'r fam parhau i fyw'n urddasol wrth i'w chof hi ddadfeilio,"" meddai.",1.8854180574417114,1.9671521186828613
268,britllm/britllm-3b-v0.1,cy_ccg_train:00699,It is impossible to avoid dropping in to feel the sand between your toes as you walk the Wales Coast Path when this magnificent beach appears beneath you.,Mae'n amhosib osgoi galw draw i deimlo'r tywod rhwng bodiau eich traed wrth i chi gerdded Llwybr Arfordir Cymru pan fydd y traeth rhagorol hwn yn ymddangos o danoch chi.,gerdded,SM,MS,cerdded,Mae'n amhosib osgoi galw draw i deimlo'r tywod rhwng bodiau eich traed wrth i chi cerdded Llwybr Arfordir Cymru pan fydd y traeth rhagorol hwn yn ymddangos o danoch chi.,1.6343629360198975,1.7051998376846313
269,britllm/britllm-3b-v0.1,cy_ccg_test:00202,Pwyll gains Rhiannon as his wife but their firstborn son Pryderi disappears immediately after he is born.,Mae Pwyll yn ennill Rhiannon yn wraig iddo ond mae eu mab cyntafanedig Pryderi yn diflannu yn union ar ôl iddo gael ei eni.,wraig,SM,MS,gwraig,Mae Pwyll yn ennill Rhiannon yn gwraig iddo ond mae eu mab cyntafanedig Pryderi yn diflannu yn union ar ôl iddo gael ei eni.,1.8652541637420654,1.8686052560806274
270,britllm/britllm-3b-v0.1,cy_ccg_train:01027,"But it's not usual for us to see the mountains when the sun has been as strong as these two days, so the pictures are usually grey.",Ond dydi o ddim yn arferol i ni weld y mynyddoedd pan mae'r haul wedi bod mor gryf â'r dyddiau dwytha' felly mae'r lluniau fel arfer yn llwyd.,mor,no_mutation,no_mutation,for,Ond dydi o ddim yn arferol i ni weld y mynyddoedd pan mae'r haul wedi bod for gryf â'r dyddiau dwytha' felly mae'r lluniau fel arfer yn llwyd.,1.6617991924285889,1.9776135683059692
271,britllm/britllm-3b-v0.1,cy_ccg_train:01184,,Y cwlwm sy'n dynnach nag a fu erioed.,fu,SM,L,bu,Y cwlwm sy'n dynnach nag a bu erioed.,2.1150646209716797,2.4495151042938232
272,britllm/britllm-3b-v0.1,cy_ccg_train:00215,"In fact, Trelew was at a slight disadvantage, with the rains scarce when we arrived in the city about an hour earlier than expected, at six in the morning: nothing open but a cold, unwelcome café a bus station, and an old unruly crochet selling illiquid coffee from her grandma to the first customers of the day.","A deud y gwir, roedd Trelew dan anfantais braidd, a'r 'mynadd yn brin wedi i ni gyrraedd y ddinas tua awr yn gynt na'r disgwyl, am chwech y bore: dim byd yn agored ond caffi oer, di-groeso yr orsaf fysiau, a hen grinc o hogan anserchog yn gwerthu coffi sâl wysg ei thîn i gwsmeriaid cynta'r dydd.",gwsmeriaid,SM,L,cwsmeriaid,"A deud y gwir, roedd Trelew dan anfantais braidd, a'r 'mynadd yn brin wedi i ni gyrraedd y ddinas tua awr yn gynt na'r disgwyl, am chwech y bore: dim byd yn agored ond caffi oer, di-groeso yr orsaf fysiau, a hen grinc o hogan anserchog yn gwerthu coffi sâl wysg ei thîn i cwsmeriaid cynta'r dydd.",2.425152063369751,2.451751470565796
